{
  "dpr_id": "20251012_235220",
  "filename": "DPR_VOL_II_26_10_2022.pdf",
  "upload_time": "2025-10-12T23:55:32.916034",
  "extracted_data": {
    "project_title": "d to any extension of time or any compensation due to",
    "project_type": "road",
    "budget": {
      "total": 0,
      "currency": "INR",
      "details": "Not Found"
    },
    "timeline": {
      "duration": "Not specified",
      "duration_months": 0
    },
    "location": "PLAN ........................................................................................................................................ 1",
    "implementing_agency": "which carries out various",
    "word_count": 109553
  },
  "analysis": {
    "completeness_analysis": {
      "score": 60,
      "missing_sections": [
        "Project Implementation Plan (Phasing, Methodology, Quality Control, Procurement Plan)",
        "Detailed Financial Analysis (Funding Model, Cash Flow Projections, Economic Viability, Return on Investment)",
        "Detailed Risk Management Plan (Identification, Assessment, Mitigation strategies)",
        "Environmental Impact Assessment (EIA) / Environmental Management Plan (EMP)",
        "Social Impact Assessment (SIA)",
        "Sustainability Plan (operational and financial sustainability post-construction)",
        "Detailed Market Demand Analysis for the IT Park",
        "Human Resource Plan",
        "Statutory Clearances and Approvals status (beyond MITS registration)"
      ],
      "comments": "The DPR excerpt provides good detail on architectural design, structural engineering, and initial cost estimates. However, it critically lacks comprehensive sections on project implementation, financial viability beyond estimation, risk management, environmental/social impact, and sustainability, which are crucial for a robust project report for MDoNER."
    },
    "budget_validation": {
      "is_valid": false,
      "issues": [
        {
          "severity": "critical",
          "description": "Initial budget provided in project information (Rs. 0.00) is incorrect and misleading; the actual estimated cost in DPR is Rs. 114.93 Cr (including GST)."
        },
        {
          "severity": "medium",
          "description": "Ambiguity in the final budget label: 'GRAND TOTAL EXCLUDING GST (in Rs.) 114.93' while the calculation suggests 114.93 Cr is 'including GST'. This needs clarification for accurate financial reporting."
        },
        {
          "severity": "low",
          "description": "No explicit contingency budget mentioned beyond a 'cost index' adjustment, which may lead to unmanaged cost overruns."
        },
        {
          "severity": "low",
          "description": "Detailed justification for rates (e.g., Bill of Quantities, market rate analysis) is not provided in the excerpt, limiting a thorough budget adequacy review."
        }
      ],
      "comments": "While a detailed cost breakdown is provided within the DPR excerpt, the initial project budget information (Rs. 0.00) is erroneous. The final grand total label in the DPR itself is ambiguous regarding GST inclusion/exclusion. A more comprehensive financial plan, including funding sources and economic viability, is also absent."
    },
    "timeline_validation": {
      "is_realistic": false,
      "issues": [
        {
          "severity": "critical",
          "description": "No project timeline, duration, or key milestones are specified in the DPR excerpt. This is a critical omission, making effective planning, monitoring, and progress tracking impossible."
        }
      ],
      "comments": "The complete absence of a project timeline makes it impossible to assess realism or even to schedule the project. This is a severe deficiency for any development project seeking MDoNER approval."
    },
    "technical_feasibility": {
      "score": 85,
      "is_feasible": true,
      "strengths": [
        "Clear project objective and alignment with Meghalaya Information Technology Society (MITS) vision to promote ICT, ITeS, and Electronics sectors.",
        "Detailed architectural design basis with location plan, site plan, area statement, artistic impressions, and building plans.",
        "Comprehensive structural design basis adhering to relevant Indian Standard (IS) codes (e.g., IS-875, IS1893, IS-456, IS-13920, IS-800, IS 1786).",
        "Thorough consideration of critical loads, including seismic (Seismic Zone Factor Z=0.36, Importance Factor I=1.5, SMRF) and wind loads, which is crucial for the North Eastern Region.",
        "Specific load combinations for serviceability and limit state of collapse are detailed for structural design.",
        "Inclusion of design basis for other essential services (Plumbing, Fire Fighting, HVAC, Electrical) in the index, indicating integrated planning.",
        "Project location is specifically identified as Umsawlii, East Khasi Hills, Meghalaya (about 11 KM from Shillong)."
      ],
      "weaknesses": [
        "Lack of a detailed soil investigation report summary with actual soil parameters, despite mentioning 'Soil Parameters' as a design basis point.",
        "Specific details on advanced IT infrastructure within the building (e.g., data connectivity architecture, specialized server room specifications, security systems) are not elaborated in the excerpt.",
        "Absence of a detailed energy efficiency strategy or commitment to green building certifications, which are important for modern infrastructure and regional sustainability."
      ],
      "comments": "From a technical design perspective (architectural and structural), the DPR excerpt is robust, demonstrating adherence to national standards and sound engineering principles, especially for seismic design crucial for the region. The project aligns with the state's IT development goals. However, finer details on specific site soil conditions and advanced IT infrastructure components are not present in this excerpt."
    },
    "risk_assessment": {
      "overall_risk_level": "high",
      "financial_risks": [
        {
          "severity": "medium",
          "risk": "Potential for cost overruns due to lack of explicit contingency provisions and limited detailed rate justification."
        },
        {
          "severity": "medium",
          "risk": "Uncertainty regarding funding sources and long-term financial sustainability of the IT Park, which is not addressed."
        },
        {
          "severity": "low",
          "risk": "Market demand for additional IT Park space in Shillong is not detailed, posing a potential revenue generation risk for the self-sustainable vision."
        }
      ],
      "timeline_risks": [
        {
          "severity": "critical",
          "risk": "Extreme risk due to the complete absence of any project timeline, making delays inevitable and unmanageable, and impacting cost and benefits."
        }
      ],
      "environmental_risks": [
        {
          "severity": "medium",
          "risk": "No assessment of environmental impacts (e.g., waste generation, resource consumption, land use changes, pollution during construction and operation)."
        },
        {
          "severity": "medium",
          "risk": "No environmental management plan is presented to mitigate potential negative impacts in the ecologically sensitive North Eastern Region."
        }
      ],
      "resource_risks": [
        {
          "severity": "medium",
          "risk": "Potential challenges in the availability of skilled labor and specialized technical expertise in Meghalaya for construction and long-term operation/maintenance of a modern IT park."
        },
        {
          "severity": "medium",
          "risk": "Potential for delays in procurement of specialized IT and building services equipment, especially given the remote location."
        },
        {
          "severity": "low",
          "risk": "Dependence on reliable power infrastructure, which can be a common challenge in the North Eastern Region, potentially impacting IT operations."
        }
      ],
      "comments": "The overall risk level is high, primarily driven by the critical absence of a project timeline and a dedicated risk management section. Significant gaps exist in assessing financial, environmental, and resource-related risks, which are fundamental for MDoNER projects. The lack of a clear market demand analysis also adds to the operational risk."
    },
    "compliance_check": {
      "is_compliant": false,
      "guideline_gaps": [
        "Absence of a comprehensive project timeline and key milestones, a standard requirement for MDoNER DPRs.",
        "Missing comprehensive Environmental Impact Assessment (EIA) and Environmental Management Plan (EMP).",
        "Lack of a Social Impact Assessment (SIA) report.",
        "Detailed financial projections (funding mechanism, revenue streams, economic analysis) are not provided.",
        "No explicit risk assessment and mitigation framework.",
        "The project type 'road' and budget 'Rs. 0.00' initially provided in the prompt are inconsistent with the DPR text, indicating potential data entry or understanding gaps in project submission context."
      ],
      "comments": "While the technical design aspects show good compliance with Indian codes, the DPR excerpt fails to meet several key MDoNER and general project reporting guidelines, particularly regarding project timeline, comprehensive financial planning, risk management, and environmental/social impact assessments. The discrepancies in initial project details versus those found in the DPR text itself are also a concern."
    },
    "gaps_detected": [
      {
        "category": "Timeline",
        "gap": "Complete absence of project start/end dates, duration, and key milestones.",
        "severity": "critical",
        "recommendation": "Develop and submit a detailed project timeline including all major phases, durations, and dependencies."
      },
      {
        "category": "Financials",
        "gap": "Lack of a detailed funding plan, cash flow analysis, and assessment of economic viability beyond basic cost estimation.",
        "severity": "high",
        "recommendation": "Provide a comprehensive financial model including funding sources, projected cash flows, economic internal rate of return (EIRR), and financial sustainability analysis."
      },
      {
        "category": "Risk Management",
        "gap": "No dedicated section for identification, assessment, and mitigation strategies for various project risks.",
        "severity": "high",
        "recommendation": "Integrate a robust risk management plan addressing technical, financial, environmental, social, and operational risks with specific mitigation measures."
      },
      {
        "category": "Environmental",
        "gap": "Missing Environmental Impact Assessment (EIA) and Environmental Management Plan (EMP).",
        "severity": "medium",
        "recommendation": "Conduct a comprehensive EIA and develop an EMP detailing environmental impacts, proposed mitigation, and monitoring programs specific to the region."
      },
      {
        "category": "Social",
        "gap": "No Social Impact Assessment (SIA) to understand potential community impacts and benefits.",
        "severity": "medium",
        "recommendation": "Perform an SIA to identify potential social impacts and ensure community engagement and benefit-sharing strategies."
      },
      {
        "category": "Sustainability",
        "gap": "The 'Vision' mentions self-sustainability, but the DPR doesn't elaborate on how this will be achieved operationally or financially.",
        "severity": "medium",
        "recommendation": "Develop a detailed operational and financial sustainability plan for the IT Park, including revenue generation models, maintenance strategies, and energy efficiency targets."
      },
      {
        "category": "Market Analysis",
        "gap": "Limited market assessment justifying the specific need and scale for a '2nd IT Park Building'.",
        "severity": "low",
        "recommendation": "Provide a detailed market demand study for IT/ITeS space in Shillong/Meghalaya to validate the project scale and potential occupancy."
      },
      {
        "category": "Budget Clarity",
        "gap": "Ambiguity in the 'GRAND TOTAL EXCLUDING GST' label which appears to include GST, causing confusion.",
        "severity": "low",
        "recommendation": "Correct the budget labels for clarity and provide a transparent breakdown of GST application to ensure financial transparency."
      }
    ],
    "recommendations": [
      "Request the proponent to furnish a complete project timeline with detailed milestones and phasing, essential for project oversight.",
      "Mandate a comprehensive risk assessment and mitigation plan for the project, covering all identified risk categories.",
      "Insist on the submission of detailed Environmental Impact Assessment (EIA) and Social Impact Assessment (SIA) reports prior to further consideration.",
      "Require a detailed financial analysis, including funding mechanisms, cash flow projections, economic viability assessments, and a sustainability plan.",
      "Seek clarification on the final project cost labeling (GST inclusion/exclusion) and request a more granular breakdown of rates if possible for transparency.",
      "Advise the inclusion of a detailed operational and financial sustainability plan outlining strategies for self-sufficiency.",
      "Recommend a brief market demand analysis to support the need for the second IT Park building and validate its projected impact."
    ],
    "overall_score": 65,
    "approval_recommendation": {
      "decision": "REVISE",
      "confidence": 90,
      "reasoning": "The project addresses a strategic need for IT infrastructure development in Meghalaya, and the technical design (architectural & structural) is well-founded and compliant with Indian standards. However, the DPR excerpt has critical omissions, most notably the complete absence of a project timeline and a dedicated risk management plan. Significant gaps also exist in detailed financial analysis, environmental/social impact assessments, and sustainability planning. These deficiencies are fundamental for MDoNER approval and necessitate a comprehensive revision before reconsideration."
    },
    "summary": "This DPR proposes a 2nd IT Park building in Shillong, Meghalaya, demonstrating strong technical design in architecture and structure compliant with IS codes. However, it critically lacks a project timeline, detailed risk assessment, comprehensive financial analysis, and environmental/social impact assessments, which are essential for MDoNER project approval. Revision is strongly recommended due to these significant planning and reporting gaps."
  },
  "actionable_insights": [
    "Review detailed analysis for findings"
  ],
  "gaps_detected": [
    {
      "category": "Project Management",
      "gap": "Executive Summary",
      "severity": "critical",
      "impact": "A DPR typically begins with an Executive Summary that provides a concise overview of the entire project, its objectives, key findings, and recommendations. Its absence makes it difficult for decision-makers to quickly grasp the project's essence.",
      "recommendation": "Add a comprehensive Executive Summary summarizing the project's scope, objectives, key technical aspects, financial projections, environmental/social considerations, and implementation plan."
    },
    {
      "category": "Feasibility/Justification",
      "gap": "Detailed Market Feasibility Study",
      "severity": "high",
      "impact": "While the 'Vision of the Technology Park' is stated, there's no detailed analysis of the demand for IT park space in Shillong/Meghalaya, potential tenants, rental market, competitor analysis, or strategies for attracting businesses. This makes the project's economic viability and demand-driven justification uncertain.",
      "recommendation": "Include a detailed market feasibility study covering demand assessment, competitive landscape, target tenant profiles, pricing strategy, and marketing plan for the IT Park."
    },
    {
      "category": "Technical",
      "gap": "Geotechnical Investigation Report (Soil Report)",
      "severity": "high",
      "impact": "The 'Structure' section mentions 'Soil Parameters' (1.8) but does not provide the detailed geotechnical investigation report. This report is fundamental for foundation design, assessing soil bearing capacity, and identifying potential seismic or geological hazards, especially critical in a hilly region like Meghalaya. Its absence poses a significant technical risk.",
      "recommendation": "Integrate a comprehensive Geotechnical Investigation Report including bore logs, soil stratification, laboratory test results, recommendations for foundation type, and seismic design parameters."
    },
    {
      "category": "Environmental/Social",
      "gap": "Environmental Impact Assessment (EIA) and Environmental Management Plan (EMP)",
      "severity": "critical",
      "impact": "There is no mention of an EIA or EMP. For a construction project of this scale, especially in a potentially ecologically sensitive region, an EIA is a mandatory requirement for regulatory approvals. Without it, the project cannot proceed legally and could have unforeseen negative environmental consequences.",
      "recommendation": "Conduct and include a full Environmental Impact Assessment (EIA) report identifying potential environmental impacts and an Environmental Management Plan (EMP) detailing mitigation measures, monitoring, and reporting protocols."
    },
    {
      "category": "Environmental/Social",
      "gap": "Social Impact Assessment (SIA) and Resettlement & Rehabilitation (R&R) Plan",
      "severity": "high",
      "impact": "While the project is within an existing campus, large infrastructure projects often have social implications (e.g., impact on local communities, employment generation specifics, access to amenities). An SIA is crucial to understand and mitigate potential negative social impacts and ensure community benefits. If any land acquisition or displacement is involved, an R&R plan would be necessary.",
      "recommendation": "Prepare and include a Social Impact Assessment (SIA) to evaluate potential social impacts (positive and negative) and outline strategies for community engagement, local employment, and benefit sharing."
    },
    {
      "category": "Financial",
      "gap": "Detailed Financial Analysis and Funding Plan",
      "severity": "critical",
      "impact": "The 'Estimated Cost' (1.8) provides only a high-level summary. A complete DPR requires a detailed financial analysis including: a full Bill of Quantities (BoQ) for all works, rate analysis, detailed funding sources, cash flow projections, financial viability indicators (e.g., IRR, NPV, Payback Period), operating and maintenance costs, and a sensitivity analysis. Without this, stakeholders cannot assess the project's financial feasibility and sustainability.",
      "recommendation": "Add a comprehensive financial section with detailed cost breakdowns (BoQ), funding strategy (sources of finance), detailed cash flow statements, financial viability metrics (IRR, NPV, Payback), operating expenditure projections, and a risk/sensitivity analysis."
    },
    {
      "category": "Project Management",
      "gap": "Detailed Project Schedule and Implementation Plan",
      "severity": "high",
      "impact": "There is no mention of a project timeline, key milestones, critical path analysis, or a detailed implementation plan. This makes it impossible to track progress, allocate resources effectively, or manage project delivery within a specified timeframe.",
      "recommendation": "Include a detailed project schedule with key milestones, Gantt charts, critical path analysis, resource allocation plan, and a phased implementation strategy."
    },
    {
      "category": "Project Management",
      "gap": "Risk Management Plan",
      "severity": "high",
      "impact": "A comprehensive DPR must identify potential risks (technical, financial, environmental, social, political, regulatory), assess their likelihood and impact, and propose mitigation strategies. The absence of such a plan leaves the project vulnerable to unforeseen challenges and delays.",
      "recommendation": "Develop a detailed Risk Management Plan identifying all potential project risks, their probability and impact, proposed mitigation measures, and contingency plans."
    },
    {
      "category": "Project Management",
      "gap": "Project Organization and Management Structure",
      "severity": "medium",
      "impact": "The document identifies MITS as the nodal agency and Arc Test House as the consultant, but lacks details on the overall project management structure, key personnel, roles and responsibilities, decision-making processes, and communication protocols. This can lead to inefficient project execution.",
      "recommendation": "Outline the project organization chart, define roles and responsibilities of key stakeholders and project team members, and detail the project governance and reporting structure."
    },
    {
      "category": "Technical",
      "gap": "Detailed Engineering Designs (beyond Design Basis Reports) and Specifications",
      "severity": "high",
      "impact": "The index lists 'DESIGN BASIS REPORT' for Structure, Plumbing & Fire Fighting, HVAC, and Electrical, and the architectural section includes 'Building Plans' and 'Artistic Impression'. However, a full DPR typically includes or references complete detailed engineering drawings, specifications (beyond a 'List of Makes'), detailed calculations, and material selections for all disciplines. The provided text ends abruptly in the 'Structure' section, meaning the content for Plumbing, Fire Fighting, HVAC, Electrical DBRs are *not present* in this document snippet.",
      "recommendation": "Beyond the design basis, include or reference comprehensive detailed engineering drawings, complete technical specifications for all materials and systems, and supporting design calculations for all disciplines (Civil, Structural, Architectural, MEP)."
    },
    {
      "category": "Technical",
      "gap": "Utilities Provisioning Plan",
      "severity": "medium",
      "impact": "While DBRs for plumbing and electrical are mentioned in the index, a holistic plan for sourcing, connecting, and distributing critical utilities like water, power, sewage treatment, data connectivity, and solid waste management is crucial. This goes beyond the internal building systems to the external infrastructure and capacity planning.",
      "recommendation": "Include a detailed plan for the provision and management of all necessary utilities, including external connections, capacity assessment, and sustainability measures."
    },
    {
      "category": "Legal/Regulatory",
      "gap": "Legal and Regulatory Compliance & Clearances",
      "severity": "high",
      "impact": "There is no section detailing the various permits, licenses, and clearances required from local, state, and national authorities (e.g., building permits, fire safety, environmental clearances, land use approvals). This is crucial for legal commencement and execution of the project.",
      "recommendation": "List all required statutory and regulatory approvals, permits, and clearances, along with their current status and a plan for obtaining them."
    },
    {
      "category": "Project Management",
      "gap": "Operation and Maintenance (O&M) Plan",
      "severity": "medium",
      "impact": "The DPR focuses heavily on construction but lacks a plan for the long-term operation, maintenance, and facility management of the IT Park once completed. This is vital for the sustainability and efficiency of the facility.",
      "recommendation": "Develop an Operation and Maintenance (O&M) Plan detailing facility management strategies, estimated O&M costs, tenant services, security, and sustainability initiatives for the completed IT Park."
    }
  ],
  "risk_assessment": {
    "overall_risk_level": "medium",
    "overall_risk_score": 50
  },
  "language": "en",
  "conversational_response": "# DPR Analysis Report 📊\n\nHello! I've completed a comprehensive analysis of d to any extension of time or any compensation due to. Here's my detailed assessment:\n\n## 🎯 Overall Assessment\n\n**Score: 65/100**\n**Recommendation: REVISE**\n\nThis DPR proposes a 2nd IT Park building in Shillong, Meghalaya, demonstrating strong technical design in architecture and structure compliant with IS codes. However, it critically lacks a project timeline, detailed risk assessment, comprehensive financial analysis, and environmental/social impact assessments, which are essential for MDoNER project approval. Revision is strongly recommended due to these significant planning and reporting gaps.\n\n---\n\n## 💰 Budget Analysis\n\nThe project budget has been evaluated.\n\n⚠️ Some budget concerns have been identified:\n\n- **Initial budget provided in project information (Rs. 0.00) is incorrect and misleading; the actual estimated cost in DPR is Rs. 114.93 Cr (including GST).** *(Severity: Critical)*\n- **Ambiguity in the final budget label: 'GRAND TOTAL EXCLUDING GST (in Rs.) 114.93' while the calculation suggests 114.93 Cr is 'including GST'. This needs clarification for accurate financial reporting.** *(Severity: Medium)*\n- **No explicit contingency budget mentioned beyond a 'cost index' adjustment, which may lead to unmanaged cost overruns.** *(Severity: Low)*\n- **Detailed justification for rates (e.g., Bill of Quantities, market rate analysis) is not provided in the excerpt, limiting a thorough budget adequacy review.** *(Severity: Low)*\n\n**Assessment:** While a detailed cost breakdown is provided within the DPR excerpt, the initial project budget information (Rs. 0.00) is erroneous. The final grand total label in the DPR itself is ambiguous regarding GST inclusion/exclusion. A more comprehensive financial plan, including funding sources and economic viability, is also absent.\n\n---\n\n## ⏰ Timeline Evaluation\n\n⚠️ There are some concerns about the timeline:\n\n- **No project timeline, duration, or key milestones are specified in the DPR excerpt. This is a critical omission, making effective planning, monitoring, and progress tracking impossible.** *(Severity: Critical)*\n\n**Assessment:** The complete absence of a project timeline makes it impossible to assess realism or even to schedule the project. This is a severe deficiency for any development project seeking MDoNER approval.\n\n---\n\n## 🔧 Technical Feasibility\n\n**Technical Score: 85/100**\n\n**Strengths:**\n✅ Clear project objective and alignment with Meghalaya Information Technology Society (MITS) vision to promote ICT, ITeS, and Electronics sectors.\n✅ Detailed architectural design basis with location plan, site plan, area statement, artistic impressions, and building plans.\n✅ Comprehensive structural design basis adhering to relevant Indian Standard (IS) codes (e.g., IS-875, IS1893, IS-456, IS-13920, IS-800, IS 1786).\n✅ Thorough consideration of critical loads, including seismic (Seismic Zone Factor Z=0.36, Importance Factor I=1.5, SMRF) and wind loads, which is crucial for the North Eastern Region.\n✅ Specific load combinations for serviceability and limit state of collapse are detailed for structural design.\n✅ Inclusion of design basis for other essential services (Plumbing, Fire Fighting, HVAC, Electrical) in the index, indicating integrated planning.\n✅ Project location is specifically identified as Umsawlii, East Khasi Hills, Meghalaya (about 11 KM from Shillong).\n\n**Areas for Improvement:**\n⚠️ Lack of a detailed soil investigation report summary with actual soil parameters, despite mentioning 'Soil Parameters' as a design basis point.\n⚠️ Specific details on advanced IT infrastructure within the building (e.g., data connectivity architecture, specialized server room specifications, security systems) are not elaborated in the excerpt.\n⚠️ Absence of a detailed energy efficiency strategy or commitment to green building certifications, which are important for modern infrastructure and regional sustainability.\n\n**Assessment:** From a technical design perspective (architectural and structural), the DPR excerpt is robust, demonstrating adherence to national standards and sound engineering principles, especially for seismic design crucial for the region. The project aligns with the state's IT development goals. However, finer details on specific site soil conditions and advanced IT infrastructure components are not present in this excerpt.\n\n---\n\n## ⚠️ Risk Assessment\n\n**Overall Risk Level: HIGH**\n\n**💰 Financial Risks:**\n- Potential for cost overruns due to lack of explicit contingency provisions and limited detailed rate justification. *(Severity: Medium)*\n- Uncertainty regarding funding sources and long-term financial sustainability of the IT Park, which is not addressed. *(Severity: Medium)*\n- Market demand for additional IT Park space in Shillong is not detailed, posing a potential revenue generation risk for the self-sustainable vision. *(Severity: Low)*\n\n**⏰ Timeline Risks:**\n- Extreme risk due to the complete absence of any project timeline, making delays inevitable and unmanageable, and impacting cost and benefits. *(Severity: Critical)*\n\n**🌍 Environmental Risks:**\n- No assessment of environmental impacts (e.g., waste generation, resource consumption, land use changes, pollution during construction and operation). *(Severity: Medium)*\n- No environmental management plan is presented to mitigate potential negative impacts in the ecologically sensitive North Eastern Region. *(Severity: Medium)*\n\n**👷 Resource Risks:**\n- Potential challenges in the availability of skilled labor and specialized technical expertise in Meghalaya for construction and long-term operation/maintenance of a modern IT park. *(Severity: Medium)*\n- Potential for delays in procurement of specialized IT and building services equipment, especially given the remote location. *(Severity: Medium)*\n- Dependence on reliable power infrastructure, which can be a common challenge in the North Eastern Region, potentially impacting IT operations. *(Severity: Low)*\n\n---\n\n## 🔍 Identified Gaps\n\nDuring my review, I found the following information gaps that should be addressed:\n\n1. **Project Management**: Executive Summary\n   - *Severity: critical*\n   - *Recommendation: Add a comprehensive Executive Summary summarizing the project's scope, objectives, key technical aspects, financial projections, environmental/social considerations, and implementation plan.*\n\n2. **Feasibility/Justification**: Detailed Market Feasibility Study\n   - *Severity: high*\n   - *Recommendation: Include a detailed market feasibility study covering demand assessment, competitive landscape, target tenant profiles, pricing strategy, and marketing plan for the IT Park.*\n\n3. **Technical**: Geotechnical Investigation Report (Soil Report)\n   - *Severity: high*\n   - *Recommendation: Integrate a comprehensive Geotechnical Investigation Report including bore logs, soil stratification, laboratory test results, recommendations for foundation type, and seismic design parameters.*\n\n4. **Environmental/Social**: Environmental Impact Assessment (EIA) and Environmental Management Plan (EMP)\n   - *Severity: critical*\n   - *Recommendation: Conduct and include a full Environmental Impact Assessment (EIA) report identifying potential environmental impacts and an Environmental Management Plan (EMP) detailing mitigation measures, monitoring, and reporting protocols.*\n\n5. **Environmental/Social**: Social Impact Assessment (SIA) and Resettlement & Rehabilitation (R&R) Plan\n   - *Severity: high*\n   - *Recommendation: Prepare and include a Social Impact Assessment (SIA) to evaluate potential social impacts (positive and negative) and outline strategies for community engagement, local employment, and benefit sharing.*\n\n6. **Financial**: Detailed Financial Analysis and Funding Plan\n   - *Severity: critical*\n   - *Recommendation: Add a comprehensive financial section with detailed cost breakdowns (BoQ), funding strategy (sources of finance), detailed cash flow statements, financial viability metrics (IRR, NPV, Payback), operating expenditure projections, and a risk/sensitivity analysis.*\n\n7. **Project Management**: Detailed Project Schedule and Implementation Plan\n   - *Severity: high*\n   - *Recommendation: Include a detailed project schedule with key milestones, Gantt charts, critical path analysis, resource allocation plan, and a phased implementation strategy.*\n\n8. **Project Management**: Risk Management Plan\n   - *Severity: high*\n   - *Recommendation: Develop a detailed Risk Management Plan identifying all potential project risks, their probability and impact, proposed mitigation measures, and contingency plans.*\n\n9. **Project Management**: Project Organization and Management Structure\n   - *Severity: medium*\n   - *Recommendation: Outline the project organization chart, define roles and responsibilities of key stakeholders and project team members, and detail the project governance and reporting structure.*\n\n10. **Technical**: Detailed Engineering Designs (beyond Design Basis Reports) and Specifications\n   - *Severity: high*\n   - *Recommendation: Beyond the design basis, include or reference comprehensive detailed engineering drawings, complete technical specifications for all materials and systems, and supporting design calculations for all disciplines (Civil, Structural, Architectural, MEP).*\n\n11. **Technical**: Utilities Provisioning Plan\n   - *Severity: medium*\n   - *Recommendation: Include a detailed plan for the provision and management of all necessary utilities, including external connections, capacity assessment, and sustainability measures.*\n\n12. **Legal/Regulatory**: Legal and Regulatory Compliance & Clearances\n   - *Severity: high*\n   - *Recommendation: List all required statutory and regulatory approvals, permits, and clearances, along with their current status and a plan for obtaining them.*\n\n13. **Project Management**: Operation and Maintenance (O&M) Plan\n   - *Severity: medium*\n   - *Recommendation: Develop an Operation and Maintenance (O&M) Plan detailing facility management strategies, estimated O&M costs, tenant services, security, and sustainability initiatives for the completed IT Park.*\n\n---\n\n## 💡 My Recommendations\n\nBased on my analysis, here are actionable steps to strengthen this DPR:\n\n1. Review detailed analysis for findings\n\n---\n\n## ✅ Compliance Check\n\n⚠️ Some compliance gaps were found:\n\n- Absence of a comprehensive project timeline and key milestones, a standard requirement for MDoNER DPRs.\n- Missing comprehensive Environmental Impact Assessment (EIA) and Environmental Management Plan (EMP).\n- Lack of a Social Impact Assessment (SIA) report.\n- Detailed financial projections (funding mechanism, revenue streams, economic analysis) are not provided.\n- No explicit risk assessment and mitigation framework.\n- The project type 'road' and budget 'Rs. 0.00' initially provided in the prompt are inconsistent with the DPR text, indicating potential data entry or understanding gaps in project submission context.\n\n**Assessment:** While the technical design aspects show good compliance with Indian codes, the DPR excerpt fails to meet several key MDoNER and general project reporting guidelines, particularly regarding project timeline, comprehensive financial planning, risk management, and environmental/social impact assessments. The discrepancies in initial project details versus those found in the DPR text itself are also a concern.\n\n---\n\n## 📝 Final Thoughts\n\n📝 This DPR shows promise but requires revisions to address the identified gaps and concerns. Please review the detailed recommendations above and feel free to ask if you need clarification on any points.\n\n---\n\n*This analysis was generated by AI and should be reviewed by qualified professionals.*"
}